{
  "$schema": "https://json-schema.org/draft/2020-12/schema",
  "title": "Weiterer Vermoegenswert",
  "type": "array",
  "items": {
    "type": "object",
    "required": ["vermoegenswert_id", "typ", "bezeichnung", "eigentumsanteile", "status"],
    "additionalProperties": false,
    "properties": {
      "vermoegenswert_id": { "type": "string", "pattern": "^VMW-\\d{3,}$" },
      "typ": { "type": "string", "enum": ["edelmetall", "beteiligung", "sonstiges"] },
      "bezeichnung": { "type": "string", "minLength": 1 },
      "eigentumsanteile": {
        "type": "array",
        "minItems": 1,
        "items": {
          "type": "object",
          "required": ["person_id", "zaehler", "nenner"],
          "additionalProperties": false,
          "properties": {
            "person_id": { "type": "string", "pattern": "^PER-\\d{3,}$" },
            "zaehler": { "type": "integer", "minimum": 1 },
            "nenner": { "type": "integer", "minimum": 1 }
          }
        }
      },
      "status": { "type": "string", "enum": ["aktiv", "veraeussert"] },
      "quelle_hinweis": { "type": "string" },
      "quelle_standdatum": { "type": "string", "format": "date" },
      "aktiv_bis": { "type": "string", "format": "date" },
      "bemerkung": { "type": "string" }
    }
  }
}
